{
  "context_evidence_sha256": "b2584268b48bdceafd5193c01ff84030be5cb8ac5629aa4da789f82564e1dd8d",
  "dataset_id": "final-v1-diversity-revalidated",
  "development_data": true,
  "expected_matrix": {
    "cases": [
      {
        "optimization": "O0",
        "sample_id": "sample_0190"
      },
      {
        "optimization": "O1",
        "sample_id": "sample_0190"
      },
      {
        "optimization": "O2",
        "sample_id": "sample_0190"
      },
      {
        "optimization": "O3",
        "sample_id": "sample_0190"
      },
      {
        "optimization": "O0",
        "sample_id": "sample_0232"
      },
      {
        "optimization": "O1",
        "sample_id": "sample_0232"
      },
      {
        "optimization": "O2",
        "sample_id": "sample_0232"
      },
      {
        "optimization": "O3",
        "sample_id": "sample_0232"
      },
      {
        "optimization": "O0",
        "sample_id": "sample_0247"
      },
      {
        "optimization": "O1",
        "sample_id": "sample_0247"
      },
      {
        "optimization": "O2",
        "sample_id": "sample_0247"
      },
      {
        "optimization": "O3",
        "sample_id": "sample_0247"
      },
      {
        "optimization": "O0",
        "sample_id": "sample_0279"
      },
      {
        "optimization": "O1",
        "sample_id": "sample_0279"
      },
      {
        "optimization": "O2",
        "sample_id": "sample_0279"
      },
      {
        "optimization": "O3",
        "sample_id": "sample_0279"
      },
      {
        "optimization": "O0",
        "sample_id": "sample_0282"
      },
      {
        "optimization": "O1",
        "sample_id": "sample_0282"
      },
      {
        "optimization": "O2",
        "sample_id": "sample_0282"
      },
      {
        "optimization": "O3",
        "sample_id": "sample_0282"
      },
      {
        "optimization": "O0",
        "sample_id": "sample_0311"
      },
      {
        "optimization": "O1",
        "sample_id": "sample_0311"
      },
      {
        "optimization": "O2",
        "sample_id": "sample_0311"
      },
      {
        "optimization": "O3",
        "sample_id": "sample_0311"
      },
      {
        "optimization": "O0",
        "sample_id": "sample_0326"
      },
      {
        "optimization": "O1",
        "sample_id": "sample_0326"
      },
      {
        "optimization": "O2",
        "sample_id": "sample_0326"
      },
      {
        "optimization": "O3",
        "sample_id": "sample_0326"
      },
      {
        "optimization": "O0",
        "sample_id": "sample_0369"
      },
      {
        "optimization": "O1",
        "sample_id": "sample_0369"
      },
      {
        "optimization": "O2",
        "sample_id": "sample_0369"
      },
      {
        "optimization": "O3",
        "sample_id": "sample_0369"
      }
    ],
    "conditions": [
      "retained",
      "stripped"
    ]
  },
  "observations": [
    {
      "binary_manifestation": "present",
      "capacity_visibility": "explicit",
      "condition": "retained",
      "context_eligible": true,
      "context_rejection_reason": null,
      "cwe": "CWE-122",
      "evidence_locality": "local",
      "inference_disposition": "eligible",
      "inference_eligible": true,
      "observation_id": "retained:sample_0190:O0",
      "optimization": "O0",
      "pair_id": "pair_0277",
      "prompt_tokens": 1734,
      "record_path": "records/retained/sample_0190_O0.json",
      "record_sha256": "f396db464deddac1adc6f2902608bece24879fad8711765ea218b98d7360d0c2",
      "rendered_prompt_sha256": "3b9399f6e3771aca0b205ba1b84d975b13c9692952a058df1723a0812bd57950",
      "sample_id": "sample_0190",
      "source_ground_truth": "not_vulnerable",
      "target_effect_ground_truth": "not_vulnerable"
    },
    {
      "binary_manifestation": "present",
      "capacity_visibility": "explicit",
      "condition": "retained",
      "context_eligible": true,
      "context_rejection_reason": null,
      "cwe": "CWE-122",
      "evidence_locality": "local",
      "inference_disposition": "eligible",
      "inference_eligible": true,
      "observation_id": "retained:sample_0190:O1",
      "optimization": "O1",
      "pair_id": "pair_0277",
      "prompt_tokens": 1885,
      "record_path": "records/retained/sample_0190_O1.json",
      "record_sha256": "1f66060f28e077477acfe4ce9465137d8db2ab64fcc46f9eed713dc02f61c2ee",
      "rendered_prompt_sha256": "df40c5ce989c62fc54742427251f3422a4e79e0763e27aed5d51d18a6f1a6da9",
      "sample_id": "sample_0190",
      "source_ground_truth": "not_vulnerable",
      "target_effect_ground_truth": "not_vulnerable"
    },
    {
      "binary_manifestation": "present",
      "capacity_visibility": "explicit",
      "condition": "retained",
      "context_eligible": true,
      "context_rejection_reason": null,
      "cwe": "CWE-122",
      "evidence_locality": "local",
      "inference_disposition": "eligible",
      "inference_eligible": true,
      "observation_id": "retained:sample_0190:O2",
      "optimization": "O2",
      "pair_id": "pair_0277",
      "prompt_tokens": 1884,
      "record_path": "records/retained/sample_0190_O2.json",
      "record_sha256": "a00e5a9860352f3ad42e797fa2d20cb89de7718b27e250a9c52346509a95a6fa",
      "rendered_prompt_sha256": "6cba77ac6cacdad2866020703abcb506879454745c588567deb29889eb6e3316",
      "sample_id": "sample_0190",
      "source_ground_truth": "not_vulnerable",
      "target_effect_ground_truth": "not_vulnerable"
    },
    {
      "binary_manifestation": "present",
      "capacity_visibility": "explicit",
      "condition": "retained",
      "context_eligible": true,
      "context_rejection_reason": null,
      "cwe": "CWE-122",
      "evidence_locality": "local",
      "inference_disposition": "eligible",
      "inference_eligible": true,
      "observation_id": "retained:sample_0190:O3",
      "optimization": "O3",
      "pair_id": "pair_0277",
      "prompt_tokens": 1884,
      "record_path": "records/retained/sample_0190_O3.json",
      "record_sha256": "a00e5a9860352f3ad42e797fa2d20cb89de7718b27e250a9c52346509a95a6fa",
      "rendered_prompt_sha256": "6cba77ac6cacdad2866020703abcb506879454745c588567deb29889eb6e3316",
      "sample_id": "sample_0190",
      "source_ground_truth": "not_vulnerable",
      "target_effect_ground_truth": "not_vulnerable"
    },
    {
      "binary_manifestation": "present",
      "capacity_visibility": "explicit",
      "condition": "retained",
      "context_eligible": true,
      "context_rejection_reason": null,
      "cwe": "CWE-122",
      "evidence_locality": "local",
      "inference_disposition": "eligible",
      "inference_eligible": true,
      "observation_id": "retained:sample_0232:O0",
      "optimization": "O0",
      "pair_id": "pair_0232",
      "prompt_tokens": 2289,
      "record_path": "records/retained/sample_0232_O0.json",
      "record_sha256": "799d32d54111f9a4540e28851ab75a459a2c36408a09326874caca12260441c3",
      "rendered_prompt_sha256": "70975abeaac70a5892be294f85aef54b5ff4d9d135fcecdc6131805b28003bf5",
      "sample_id": "sample_0232",
      "source_ground_truth": "vulnerable",
      "target_effect_ground_truth": "vulnerable"
    },
    {
      "binary_manifestation": "present",
      "capacity_visibility": "explicit",
      "condition": "retained",
      "context_eligible": true,
      "context_rejection_reason": null,
      "cwe": "CWE-122",
      "evidence_locality": "local",
      "inference_disposition": "eligible",
      "inference_eligible": true,
      "observation_id": "retained:sample_0232:O1",
      "optimization": "O1",
      "pair_id": "pair_0232",
      "prompt_tokens": 1265,
      "record_path": "records/retained/sample_0232_O1.json",
      "record_sha256": "8cc6224d4135b21acb74b9a9d561a29d218a7b37670ab4fcbb3a3bad221ed408",
      "rendered_prompt_sha256": "13f02e1697b52b9f3a0428e6985fda2a65c892f47603338fa922e08cb405ea7f",
      "sample_id": "sample_0232",
      "source_ground_truth": "vulnerable",
      "target_effect_ground_truth": "vulnerable"
    },
    {
      "binary_manifestation": "eliminated",
      "capacity_visibility": "not_applicable",
      "condition": "retained",
      "context_eligible": null,
      "context_rejection_reason": null,
      "cwe": "CWE-122",
      "evidence_locality": "not_applicable",
      "inference_disposition": "proven_eliminated",
      "inference_eligible": false,
      "observation_id": "retained:sample_0232:O2",
      "optimization": "O2",
      "pair_id": "pair_0232",
      "prompt_tokens": null,
      "record_path": null,
      "record_sha256": null,
      "rendered_prompt_sha256": null,
      "sample_id": "sample_0232",
      "source_ground_truth": "vulnerable",
      "target_effect_ground_truth": null
    },
    {
      "binary_manifestation": "eliminated",
      "capacity_visibility": "not_applicable",
      "condition": "retained",
      "context_eligible": null,
      "context_rejection_reason": null,
      "cwe": "CWE-122",
      "evidence_locality": "not_applicable",
      "inference_disposition": "proven_eliminated",
      "inference_eligible": false,
      "observation_id": "retained:sample_0232:O3",
      "optimization": "O3",
      "pair_id": "pair_0232",
      "prompt_tokens": null,
      "record_path": null,
      "record_sha256": null,
      "rendered_prompt_sha256": null,
      "sample_id": "sample_0232",
      "source_ground_truth": "vulnerable",
      "target_effect_ground_truth": null
    },
    {
      "binary_manifestation": "present",
      "capacity_visibility": "explicit",
      "condition": "retained",
      "context_eligible": true,
      "context_rejection_reason": null,
      "cwe": "CWE-122",
      "evidence_locality": "local",
      "inference_disposition": "eligible",
      "inference_eligible": true,
      "observation_id": "retained:sample_0247:O0",
      "optimization": "O0",
      "pair_id": "pair_0277",
      "prompt_tokens": 1740,